{
  "schemaVersion": "phase7-report-v1",
  "status": "passed",
  "stage": "worker-player",
  "matrixKey": {
    "modelId": "uvr_mdxnet_3_9662",
    "artifactSha256": "f74eee1ac06845a7cf277416138b19a6203f34316a3a74b2bde19acbfb2f8378",
    "contractId": "uvr_mdxnet_3_9662@2",
    "contractSchemaVersion": 2,
    "abi": "armeabi-v7a",
    "backend": "LiteRtCpu",
    "profileId": "cpu-default-fp32-v1",
    "precision": "Float32"
  },
  "identity": {
    "appCommit": "b01b7c0e577b5d04c61ea370fc51b674aee19131",
    "appApkSha256": "5ffae498b66fc8a424e3fbd39c04a35ef1727587717aa2a9fe1944d74ec96489",
    "testApkSha256": "89ff3ed8712ac4508870b562704b3b81d7b8bca23cd97f88fa1ce90121dab7d3",
    "catalogSha256": "a553f227588313578321c07c73ff99654eff7795727d825d16b191aa0f879e1f",
    "catalogSourceRevision": "28d9a076c8a44980085a059e6224768ae77f9c8a",
    "modelReleaseTag": "v0.1.0-candidates.1",
    "artifactFileName": "UVR_MDXNET_3_9662_static_float32.tflite",
    "artifactSha256": "f74eee1ac06845a7cf277416138b19a6203f34316a3a74b2bde19acbfb2f8378",
    "contractId": "uvr_mdxnet_3_9662@2",
    "contractSchemaVersion": 2,
    "pipelineCompatibilityVersion": "booming-ss-mdx-stft-v1",
    "litertVersion": "2.1.5",
    "runnerRevision": "phase7-runner-v11",
    "thresholdsVersion": "phase7-thresholds-v2",
    "fixturesVersion": "phase7-fixtures-v2"
  },
  "device": {
    "serial": "192.168.8.181:35975",
    "manufacturer": "samsung",
    "model": "SM-G9730",
    "androidApi": 31,
    "buildFingerprint": "samsung\/beyond1qltezc\/beyond1q:12\/SP1A.210812.016\/G9730ZCU8HWE2:user\/release-keys",
    "processAbi": "armeabi-v7a",
    "runtimeAbi": "armeabi-v7a",
    "bitness": 32,
    "availableProcessors": 8
  },
  "fixture": {
    "fixtureId": "coast_town_full_wav",
    "fileName": "_-_Coast_Town__decoded.wav",
    "byteSize": 48280564,
    "sha256": "e845e52aeeeb69be702d3a28d756eaf7a3137dbe5338ea50fb0ac3d8c4f9bd89",
    "durationUs": 273699093,
    "sampleRate": 44100,
    "channels": 2,
    "codec": "pcm_s16le",
    "decodeClass": "wav-window",
    "expectedDecode": null,
    "expectedOutputSampleRate": null,
    "expectedOutputFrameCount": null
  },
  "run": {
    "runId": "phase7-9662-s10-arm32-recreation-v1",
    "class": "cold-session",
    "cpuThreads": 4,
    "windowDecodeEnabled": true,
    "cleanInstallScenario": false,
    "xnnPackFlags": null,
    "autoFailpoint": "none",
    "backendRequested": "LiteRtCpu",
    "backendUsed": "LiteRtCpu",
    "fallbackStage": null,
    "fallbackReason": null
  },
  "timing": {
    "downloadMs": null,
    "installMs": null,
    "firstReadyMs": 0,
    "fullSongMs": 0,
    "cancellationLatencyMs": 0,
    "windowMs": []
  },
  "memory": {
    "idlePssBytes": 0,
    "peakPssBytes": 0,
    "peakPssDeltaBytes": 0,
    "peakJavaBytes": 0,
    "peakNativeBytes": 0,
    "peakGraphicsBytes": 0
  },
  "thermal": {
    "available": false,
    "samples": []
  },
  "lifecycle": {
    "workerCompleted": true,
    "mediaSessionConnected": false,
    "pauseResumePassed": false,
    "seekPassed": false,
    "processRecreationPassed": true,
    "cancellationPassed": false
  },
  "audio": {
    "finite": true,
    "outputFrameCount": 12070130,
    "expectedFrameCount": 12070130,
    "frameDelta": 0,
    "snrDb": 0,
    "maxAbsError": 0,
    "reconstructionMaxAbsError": 0,
    "maxJoinDiscontinuity": 0,
    "playerTimestampDriftMs": 0,
    "stemSemantics": "Vocals,Instrumental"
  },
  "cache": {
    "cacheKey": "469fd161f404025c8ee1abf9fc6c26c753894ba18347a1dfedd3b0c88c19dd34",
    "entryCountBefore": 0,
    "entryCountAfter": 0,
    "exactIdentity": true,
    "completedPlayable": true,
    "clearRecoveryPassed": false,
    "runtimeRecords": [
      {
        "backend": "LiteRtCpu",
        "runtimeProfileId": "uvr_mdxnet_3_9662@2",
        "precision": "fp32",
        "elapsedMs": 251274,
        "fallbackStage": null,
        "fallbackReason": null
      }
    ],
    "hydratedPlayable": true,
    "manifestState": "Completed"
  }
}
